{
  "ragas_version": "0.3.6",
  "original_hash": 1416253007657698527,
  "language": "euskara",
  "instruction": "Given a question and an answer, analyze the complexity of each sentence in the answer. Break down each sentence into one or more fully understandable statements. Ensure that no pronouns are used in any statement. Then, your task is to judge the faithfulness of these statements based on a given context. For each statement you must return verdict as 1 if the statement can be directly inferred based on the context or 0 if the statement can not be directly inferred based on the context. Output format: {\"statements\": [{\"statement\": <statement>, \"reason\": <explanation>, \"verdict\": <1 or 0>}, ...]}. Response only this json.",
  "examples": [
    {
      "input": {
        "question": "Nor da John eta zer egiten ari da?",
        "context": "John XYZ Unibertsitateko ikaslea da. Informatikako gradua egiten ari da. Aurten hainbat ikastaroetan izena eman du, hala nola Datu Egitura, Algoritmoak eta Datu-baseen Kudeaketa. John ikasle arduratsua da eta denbora asko eskaintzen du ikasteari eta lanak burutzeari. Askotan berandu arte gelditzen da liburutegian bere proiektuetan lan egiteko.",
        "answer": "John Biologian espezializatzen da eta Adimen Artifizialari buruzko ikastaro bat egiten ari da. John ikasle dedikatua da eta lanaldi partzialeko lana du."
      },
      "output": {
        "statements": [
          {
            "statement": "John Biologian espezializatzen da.",
            "reason": "Johnen espezialitatea esplizituki Informatika gisa aipatzen da. Ez dago Biologian espezializatzen dela adierazten duen informaziorik.",
            "verdict": 0
          },
          {
            "statement": "John Adimen Artifizialari buruzko ikastaro bat egiten ari da.",
            "reason": "Testuinguruak John gaur egun matrikulatuta dagoen ikastaroak aipatzen ditu, baina ez du Adimen Artifiziala aipatzen. Beraz, ezin da ondorioztatu ikastaro hori egiten ari denik.",
            "verdict": 0
          },
          {
            "statement": "John ikasle dedikatua da.",
            "reason": "Testuinguruak dio denbora asko eskaintzen duela ikasteari eta lanak burutzeari. Gainera, askotan berandu arte gelditzen dela liburutegian bere proiektuetan lan egiteko, dedikazioa adierazten duena.",
            "verdict": 1
          },
          {
            "statement": "Johnek lanaldi partzialeko lana du.",
            "reason": "Testuinguruan ez da aipatzen Johnek lanaldi partzialeko lanik duenik.",
            "verdict": 0
          }
        ]
      }
    },
    {
    "input": {
        "question": "Zer da fotosintesia?",
        "context": "Fotosintesia landareek, algek eta bakterio mota batzuek erabiltzen duten prozesua da, argi-energia energia kimiko bihurtzeko.",
        "answer": "Fotosintesia landareek erabiltzen duten prozesu biologiko bat da, argi-energia energia kimiko bihurtzeko erabiltzen dena. Fotosintesia animaliek ere erabiltzen dute arnasketarako energia lortzeko."
      },
      "output": {
        "statements": [
          {
            "statement": "Fotosintesia landareek erabiltzen duten prozesu biologiko bat da.",
            "reason": "Testuinguruak zehazki dio fotosintesia landareek erabiltzen duten prozesua dela, beraz baieztapena zuzena da.",
            "verdict": 1
          },
          {
            "statement": "Fotosintesia argi-energia energia kimiko bihurtzeko erabiltzen da.",
            "reason": "Testuinguruak hori esplizituki adierazten du, beraz baieztapena zuzena da.",
            "verdict": 1
          },
          {
            "statement": "Fotosintesia animaliek erabiltzen dute arnasketarako energia lortzeko.",
            "reason": "Testuinguruak ez du aipatzen animaliek fotosintesia erabiltzen dutenik, beraz baieztapena ez da zuzena.",
            "verdict": 0
          }
        ]
      }
    }
  ]
}
